{
  "schemaVersion": 1,
  "capturedAt": "2026-08-21T09:31:23.782Z",
  "sourceCommit": "f9e3d4d066f11152a1519559d12f388a75b44410",
  "upstreams": [
    {
      "id": "stock_data",
      "url": "https://mcp.wind.com.cn/vserver_stock_data/mcp/",
      "transport": "streamable-http",
      "serverInfo": {
        "name": "wind-mcp-streamable-http-stateless",
        "version": "1.25.0"
      },
      "tools": [
        {
          "name": "get_risk_metrics",
          "description": "获取股票风险与波动性指标，涵盖Beta（标准、剔除财务杠杆、剔除所得税率）、Jensen Alpha（定期及年化）、波动率（年化及非年化，覆盖最近100周/24个月/60个月）、夏普比率（定期及年化）、最大回撤及区间下跌天数、在险价值VaR（参数法与历史法）、财务安全比率（资产负债率、速动比率、流动比率、净资产负债率）、以及基准相关系数。",
          "inputSchema": {
            "type": "object",
            "properties": {
              "question": {
                "title": "查询语句",
                "description": "自然语言查询要求：股票实体（名称或股票代码） + 量化风险指标（Beta、年化波动率、最大回撤、夏普比率、VaR等）+ 回看窗口或日期。示例：查询宁德时代(300750.SZ)过去1年的Beta、年化波动率和最大回撤。",
                "type": "string"
              }
            },
            "required": [
              "question"
            ]
          }
        },
        {
          "name": "get_stock_basicinfo",
          "description": "返回指定股票的公司身份与分类档案，为静态数据，包括：简称、代码、曾用名、上市板块与上市日期、行业分类、概念标签、指数成份归属、工商注册信息、主营业务简介，以及当前状态标签（是否 ST、是否已摘牌）。仅返回当前状态，不含状态变动历史、财务数据与股东明细。",
          "inputSchema": {
            "type": "object",
            "properties": {
              "question": {
                "title": "查询语句",
                "description": "自然语言查询要求：股票实体（名称或股票代码）+ 需要的档案项（简称、上市板、上市日期、WIND行业分类、所属概念板块、经营范围、主营产品、是否风险警示等）。静态或准静态档案，通常无需时间限定。示例：查询贵州茅台的上市板与行业分类。",
                "type": "string"
              }
            },
            "required": [
              "question"
            ]
          }
        },
        {
          "name": "get_stock_equity_holders",
          "description": "返回指定股票的股本结构与股东构成，为准静态数据，随报告期与权益变动更新，包括：总股本、流通 A 股、限售股、自由流通股本及占比；前十大股东与前十大流通股东持仓及变动；机构股东持股；实际控制人与大股东详情；限售解禁时间表与本期解禁数量。不含市值（由价格与股本派生）。",
          "inputSchema": {
            "type": "object",
            "properties": {
              "question": {
                "title": "查询语句",
                "description": "自然语言查询要求：证券实体 + 股本/股东指标（总股本、流通A股、限售股、前十大股东、解禁时间表等）+ 报告期。示例：查询贵州茅台(600519.SH)的前十大股东及流通A股占比。",
                "type": "string"
              }
            },
            "required": [
              "question"
            ]
          }
        },
        {
          "name": "get_stock_events",
          "description": "返回指定股票的公司行动与事件数据，为结构化记录而非公告文本。事件类型覆盖：首发上市与再融资（配股、增发、并购重组）；分红派息；股本与股东事件（大股东增减持、限售解禁）；治理与监管事件（风险警示与 ST 变动、违规处罚、司法诉讼）。仅返回结构化字段，不含公告与新闻文本原文，不含公司当前状态标签。",
          "inputSchema": {
            "type": "object",
            "properties": {
              "question": {
                "title": "查询语句",
                "description": "自然语言查询要求：股票实体（名称或股票代码）+ 事件类型（分红派息、增发配股、并购重组、增减持、限售解禁、ST变动、诉讼处罚等）+ 日期或时间范围。示例：查询贵州茅台(600519.SH)的分红派息历史。",
                "type": "string"
              }
            },
            "required": [
              "question"
            ]
          }
        },
        {
          "name": "get_stock_fundamentals",
          "description": "返回指定股票的两类基本面数据。第一类为财务原始指标：三大报表科目，偿债、盈利、成长、杠杆等财务比率（如 ROE、毛利率、资产负债率、速动比率），以及行业专项指标（如银行净息差、不良贷款率），时间维度为报告期。第二类为衍生估值指标：PE、PB、PS（TTM 口径）、股息率、总市值与流通市值及其历史分位数，随交易日变动。不含价格序列。",
          "inputSchema": {
            "type": "object",
            "properties": {
              "question": {
                "title": "查询语句",
                "description": "自然语言查询要求：证券实体（名称或Wind代码）+ 财务/估值指标 + 日期或报告期。示例：查询贵州茅台(600519.SH)2024-12-31的ROE、营业收入和净利润。",
                "type": "string"
              }
            },
            "required": [
              "question"
            ]
          }
        },
        {
          "name": "get_stock_kline",
          "description": "返回指定股票在给定时间范围内的聚合量价序列（K 线），聚合周期由 period 指定（分钟级至年，默认日 K）。每条记录代表一个周期，包含开盘价、收盘价、最高价、最低价、成交量、成交额、均价、换手率。当日盘中分钟走势建议用分钟级行情工具（缺省即最新交易日）；锚定当前的相对窗口统计（近 N 日涨跌幅、年初至今涨跌幅、52 周高低）与基准指数对比不在本工具范围。",
          "inputSchema": {
            "type": "object",
            "properties": {
              "windcode": {
                "title": "Wind代码",
                "description": "股票名称或者股票代码，如贵州茅台或600519.SH。",
                "type": "string"
              },
              "begin_date": {
                "title": "开始日期",
                "description": "开始日期：格式yyyy-MM-dd，如2026-03-25. ",
                "type": "string"
              },
              "end_date": {
                "title": "结束日期",
                "description": "结束日期，格式为yyyy-MM-dd,如2026-03-26.",
                "type": "string"
              },
              "period": {
                "title": "K线周期",
                "description": "K线周期：默认10(日K)。可选值：1=1分钟，3=5分钟，4=10分钟，5=15分钟，6=30分钟，7=60分钟，8=120分钟，9=240分钟，10=日K，11=周K，12=月K，13=年K，14=季K，15=半年K。常用：日K=10，周K=11，月K=12",
                "default": "10",
                "type": "string"
              },
              "aftype": {
                "title": "复权类型",
                "description": "复权类型：0=前复权，1=后复权，2=不复权，默认0。",
                "default": "0",
                "type": "string"
              },
              "issusp": {
                "title": "是否包含停牌",
                "description": "是否包含停牌数据：0=不包含，1=包含，默认1",
                "default": "1",
                "type": "string"
              },
              "afdate": {
                "title": "复权基准日期",
                "description": "复权基准日期，格式yyyy-MM-dd，如2026-03-25。通常不需要指定",
                "type": "string"
              }
            },
            "required": [
              "windcode",
              "begin_date",
              "end_date"
            ]
          }
        },
        {
          "name": "get_stock_price_indicators",
          "description": "获取一个或多个股票当前时刻的行情指标快照值（时点数据、非时间序列）。指标经 indexes 指定，取值须逐字取自其可选值清单（如 最新成交价、今日开盘价、今日最高价、今日最低价、涨跌幅、成交量、换手率等）；不填 indexes 时默认返回：最新交易日、交易时间、最新成交价、前收盘价、今日开盘价、今日最高价、今日最低价、成交量。仅返回时点截面，不含当日走势与历史区间序列。用户询问股票的当前/最新价格或某个行情指标值时使用。",
          "inputSchema": {
            "type": "object",
            "properties": {
              "windcode": {
                "type": "string",
                "title": "Wind代码",
                "description": "一个或多个股票名称或股票代码，多个代码用英文逗号分隔，如600519.SH,600000.SH。"
              },
              "indexes": {
                "type": "string",
                "title": "行情指标",
                "description": "行情指标字段，多个字段用逗号分隔。可选值：最新交易日,交易时间,中文简称,最新成交价,前收盘价,今日开盘价,今日最高价,今日最低价,最新均价,涨跌,涨跌幅,成交量,成交额,交易状态,上市日期,近1分钟成交额,近3分钟成交额,近5分钟成交额,K线实体涨跌幅,K线实体涨跌额,换手率,量比,振幅,基于Wind算法的量比,现量,现额,买一价,买二价,买三价,买四价,买五价,卖一价,卖二价,卖三价,卖四价,卖五价,买一量,买二量,买三量,买四量,买五量,卖一量,卖二量,卖三量,卖四量,卖五量,外盘,内盘,成交笔数,委比,当日主力净流入额,当日主力净流入占比,近5日主力净流入额,近5日主力净流入占比,近5日主力净流入天数,近10日主力净流入额,近10日主力净流入占比,近10日主力净流入天数,近20日主力净流入额,近20日主力净流入占比,近20日主力净流入天数,近60日主力净流入额,近60日主力净流入占比,近60日主力净流入天数,主力挂单买入,主力挂单卖出,主力撤单买入,主力撤单卖出,该日机构资金净流入额,该日大户资金净流入额,该日中户资金净流入额,该日散户资金净流入额,连红天数,连续上涨天数,火箭发射,高台跳水,涨停封板,跌停封板,涨停开板,跌停开板,涨幅达到3%,跌幅达到3%,创20日新高,创20日新低,盘前最新价,盘前涨跌额,盘前涨跌幅,盘前成交额,盘前涨速,盘后最新价,盘后涨跌幅,集合竞价涨跌幅,指数平滑异同移动平均,DIF快线,随机指标K值,随机指标D值,随机指标J值,6周期相对强弱指标,12周期相对强弱指标,抛物线转向指标,布林中轨,布林上轨,布林下轨,5周期移动平均,10周期移动平均,20周期移动平均,60周期移动平均,120周期移动平均,250日均线,5日乖离率,36日乖离,14周期顺势指标,26周期能量指标,12周期心理线指标,近1分钟涨跌幅,近3分钟涨跌幅,MACD多头金叉信号,MACD空头死叉信号,5分钟涨跌幅,5日涨跌幅,10日涨跌幅,20日涨跌幅,60日涨跌幅,120日涨跌幅,250日涨跌幅,年初至今涨跌幅,上市以来涨跌幅,近3年涨跌幅,近5年涨跌幅,近10年涨跌幅,近20年涨跌幅,流通份额,发行价,总股本,市净率,市净率(LF),市盈率(TTM),市盈率(LYR),市盈率(预测),总市值1,流通市值,总市值2,52周最高,52周最低,股息率,涨停价,跌停价,成分股贡献点数,近5分钟贡献度",
                "default": "最新交易日,交易时间,最新成交价,前收盘价,今日开盘价,今日最高价,今日最低价,成交量"
              }
            },
            "required": [
              "windcode"
            ]
          }
        },
        {
          "name": "get_stock_quote",
          "description": "返回指定股票的分钟级量价序列，每条记录代表一分钟，包含开盘价、最新成交价、最高价、最低价、成交量、成交额、均价与换手率。时间范围由 begin/end 指定（含首尾），未指定默认最新交易日；单日约 240 条，跨日体积按天数放大，长区间建议改用 K 线工具的聚合周期。仅交易日有数据，非交易日返回空结果。当前时刻截面状态请用行情快照工具。",
          "inputSchema": {
            "type": "object",
            "properties": {
              "windcode": {
                "type": "string",
                "title": "Wind代码",
                "description": "股票名称或者股票代码，如贵州茅台或600519.SH。"
              },
              "begin": {
                "type": "string",
                "title": "查询开始日期",
                "description": "开始日期，格式 yyyy-MM-dd，如 2026-03-25；未指定默认最新交易日。不可只传 end 不传 begin。"
              },
              "end": {
                "type": "string",
                "title": "查询结束日期",
                "description": "结束日期，格式 yyyy-MM-dd，如 2026-03-25；未指定默认最新交易日（即只传 begin 时返回 begin 至最新交易日的区间）。"
              }
            },
            "required": [
              "windcode"
            ]
          }
        },
        {
          "name": "get_stock_technicals",
          "description": "返回指定股票由行情数据计算的派生指标，日频为主。相对窗口统计：近 N 日、周、月、年及年初至今涨跌幅，52 周最高最低价，相对基准指数表现，均锚定当前滚动。技术指标：趋势类、成交量类、超买超卖类、波动类（如 MACD、KDJ、RSI、BOLL 等）。技术形态：连续涨跌、创新高或新低检测、突破反转、涨跌停与连板状态等。不含原始行情序列、实时快照与风险统计量。",
          "inputSchema": {
            "type": "object",
            "properties": {
              "question": {
                "title": "查询语句",
                "description": "自然语言查询要求：股票实体（名称或股票代码）+ 技术指标或形态（MACD、KDJ、RSI、BOLL、均线、区间涨跌幅、连板/新高等）+ 日期。示例：查询贵州茅台(600519.SH)最近20日的收盘价与MACD。",
                "type": "string"
              }
            },
            "required": [
              "question"
            ]
          }
        },
        {
          "name": "search_stocks",
          "description": "根据自然语言筛选条件从 A 股及海外股票市场反查股票，返回符合条件的股票代码列表。支持按指标数值（行情、财务、估值、资金、技术等）与业务分类（行业板块、主题概念、主营业务）组合条件，返回的代码可传入各属性查询工具获取具体数据。已指定具体股票时不要调用本工具。",
          "inputSchema": {
            "type": "object",
            "properties": {
              "question": {
                "title": "查询语句",
                "description": "自然语言选股问句，描述筛选条件（如市值、涨跌幅、行业、上市板等），返回符合条件的代码列表。例：筛选沪深市场市值超500亿且连续5日上涨的股票",
                "type": "string"
              }
            },
            "required": [
              "question"
            ]
          }
        }
      ]
    },
    {
      "id": "fund_data",